{
  "schema_version": "0.1.0",
  "run_id": "2026-06-20-phase-3-review-decision-memory-implementation",
  "generated_at": "2026-06-21T02:54:43Z",
  "disposition": "findings-triaged",
  "recommended_status": "reviewed",
  "decision_owner": "codex",
  "source_evidence": [
    {
      "type": "review-output",
      "path": "harness/runs/2026-06-20-phase-3-review-decision-memory-implementation/reviews/claude-review.json"
    },
    {
      "type": "review-evidence",
      "path": "harness/runs/2026-06-20-phase-3-review-decision-memory-implementation/reviews/claude-review-evidence.json"
    }
  ],
  "severity_counts": {
    "critical": 0,
    "high": 0,
    "medium": 0,
    "low": 3,
    "info": 4
  },
  "resolved_findings": [
    {
      "title": "Semantic validator misses high/critical findings on risk-accepted disposition",
      "severity": "medium",
      "evidence": "Fixed with validate_review_decision_semantics requiring accepted_risks for risk-accepted/risk_accepted decisions with high or critical severity, plus a negative regression test."
    },
    {
      "title": "Dead elif branch in validate_handoff_closure memory_files handling",
      "severity": "low",
      "evidence": "Resolved by collapsing memory_files handling to a single non-list check after the final Claude review."
    },
    {
      "title": "review-decision.json in the run dir is codex-authored, not produced by an external Claude Code review",
      "severity": "info",
      "evidence": "Resolved for provenance by invoking the real Claude Code review adapter and indexing claude-review.json, claude-review-evidence.json, and claude-review.raw.log."
    },
    {
      "title": "Schema permits empty source_evidence array",
      "severity": "low",
      "evidence": "Resolved by semantic validation requiring non-empty source_evidence for passed, findings-triaged, waived, risk-accepted, and blocked review decisions while preserving unavailable/process-failed exceptions."
    },
    {
      "title": "load_indexed_review_decision silently picks the first review-decision.json by basename",
      "severity": "low",
      "evidence": "Resolved by detecting and rejecting duplicate indexed review-decision.json evidence entries during review-decision loading."
    },
    {
      "title": "severity_counts is self-reported and not cross-validated against review content",
      "severity": "info",
      "evidence": "Resolved for calculable sources by comparing severity_counts against findings[] counts in linked review-output or review-evidence artifacts, skipping only sources whose findings cannot be computed."
    }
  ],
  "accepted_risks": [],
  "not_tested": [
    "explicit advance_run coverage for every non-required REVIEW_DECISION_TARGETS branch",
    "steady-state validate enforcement of completed-run handoff frontmatter"
  ],
  "residual_risks": [
    "handoff closure is enforced by advance -> completed, not by steady-state validate, to preserve the no-migration contract for historical runs.",
    "review-decision requiredness is scoped to reviewed/review_blocked; other review-related states reuse Phase 1 evidence contracts."
  ],
  "notes": "Real Claude Code review completed with status findings. The prior medium finding was fixed and re-reviewed; follow-up validation hardening closed the source_evidence, duplicate-decision, and severity_counts provenance gaps. The linked review-output severity_counts remain unchanged because they count the original Claude review findings."
}
